<?xml version="1.0" encoding="UTF-8"?>
<level xmlns:xsi="http://www.w3.org/2001/XMLSchema-instance" xsi:noNamespaceSchemaLocation="..\..\..\..\resources\schemas\level.xsd">
	<title value="Bombfest" />
	<author value="Vincent Labatut" />
	<source value="original" />
	<preview file="preview.jpg" />
	<instance name="tournament" />
	<theme name="tournament4" />
	<globalDimension height="15" width="15" />
	<visibleDimension height="15" width="15" />
	<visiblePosition upLine="0" leftCol="0" />
	<display forceAll="false" maximize="true" />
</level>

