<?xml version="1.0" encoding="UTF-8"?>
<level xmlns:xsi="http://www.w3.org/2001/XMLSchema-instance" xsi:noNamespaceSchemaLocation="../../../../resources/schemas/level.xsd">
	<title value="It's a trap!" />
	<author value="Ali Baran Kesimal / Işıl Varol" />
	<source value="original" />
	<preview file="preview.jpg" />
	<instance name="superbomberman1" />
	<theme name="tournament4" />
	<globalDimension height="8" width="8" />
	<visibleDimension height="8" width="8" />
	<visiblePosition upLine="0" leftCol="0" />
	<display forceAll="false" maximize="true" />
</level>

