<?xml version="1.0" encoding="UTF-8"?>
<level xmlns:xsi="http://www.w3.org/2001/XMLSchema-instance" xsi:noNamespaceSchemaLocation="..\..\..\..\resources\schemas\level.xsd">
	<title value="Qualif'4" />
	<author value="Vincent Labatut" />
	<source value="Original" />
	<preview file="preview.jpg" />
	<instance name="superbomberman1" />
	<theme name="tournament5" />
	<globalDimension height="9" width="22" />
	<visibleDimension height="7" width="22" />
	<visiblePosition upLine="1" leftCol="0" />
	<display forceAll="false" maximize="true" />
</level>

