<?xml version="1.0" encoding="UTF-8"?>
<level xmlns:xsi="http://www.w3.org/2001/XMLSchema-instance" xsi:noNamespaceSchemaLocation="..\..\..\..\resources\schemas\level.xsd">
	<title value="New level" />
	<author value="Vincent Labatut" />
	<source value="original" />
	<preview file="preview.jpg" />
	<instance name="superbomberman1" />
	<theme name="normal" />
	<globalDimension height="15" width="21" />
	<visibleDimension height="15" width="21" />
	<visiblePosition upLine="0" leftCol="0" />
	<display forceAll="true" maximize="true" />
</level>

